{
  "frame_id": "fake_traffic_frame_001",
  "source_id": "sample_video",
  "image_width": 1280,
  "image_height": 720,
  "timestamp_ms": 0,
  "detections": [
    {
      "id": "det_001",
      "class_id": 0,
      "class_name": "person",
      "confidence": 0.93,
      "box_xyxy": [
        130,
        390,
        215,
        650
      ]
    },
    {
      "id": "det_002",
      "class_id": 0,
      "class_name": "person",
      "confidence": 0.88,
      "box_xyxy": [
        245,
        410,
        315,
        660
      ]
    },
    {
      "id": "det_003",
      "class_id": 1,
      "class_name": "car",
      "confidence": 0.91,
      "box_xyxy": [
        700,
        360,
        900,
        500
      ]
    },
    {
      "id": "det_004",
      "class_id": 2,
      "class_name": "bus",
      "confidence": 0.84,
      "box_xyxy": [
        920,
        310,
        1210,
        520
      ]
    }
  ]
}